,Key,Item Type,Publication Year,Author,Title,Publication Title,ISSN,DOI,Url,Abstract Note,Date,Pages,Num Pages,Issue,Volume,Series,Publisher,Place,Language,Type,Archive,Library Catalog,Extra,Manual Tags,Number
1702,39E2D3QI,journalArticle,1934,"Chaptal, L.",De l'influence de l'humidité sur la production du vignoble méridional [On the influence of humidity on the produce of vineyard in the Midi],Comptes rendus hebdomadaires des séances de l'Académie d'agriculture de France,,,,,1934,800–804,,,20,,,,French,,,,,,
1703,JHRLEPE3,journalArticle,1936,"Huckenpahler, B. J.",Amount and distribution of moisture in a living shortleaf pine,Journal of Forestry,,,,,1936,399–401,,4,34,,,,English,,,,,,
1704,I2WA8UZA,journalArticle,1936,"Finch, A. H.; van Horn, C. W.",The moisture relations of pecan leaves,Science,,,,,1936,260,,2150,83,,,,English,,,,,,
1705,8BGP92CC,journalArticle,1935,"Aamodt, O. S.",A machine for testing the resistance of plants to injury by atmospheric drought,Canadian Journal of Research,,,,,1935,788–795,,6,12,,,,English,,,,,,
1706,4NXY4FHI,journalArticle,1935,"Humphries, W. R.; Hurst, W. M.",Moisture changes in some agricultural products due to atmospheric conditions,Agricultural Engineering,,,,,1935,8–12,,1,16,,,,English,,,,,,
1707,8XJTWRSD,journalArticle,1935,"Keen, B. A.",A preliminary report on the behaviour of the Ashby and Owens' evaporimeters,Reports of the Conference on Agricultural Meteorology in London,,,,,1935,2–7,,,,,,,English,,,,,,
1708,889IHXRF,journalArticle,1933,"Hammond, P. F.; Goslin, R,",The effect of humidity upon the rate of evaporation,Ecology,,,,,1933,411–413,,4,14,,,,English,,,,,,
1709,HBSIGEYZ,journalArticle,1934,"Brixten, P. A.; Mellanby, K.",The measurement and control of humidity,Bulletin of Entomological Research,,,,,1934,171–175,,2,25,,,,English,,,,,,
1710,IAL9DDXE,journalArticle,1934,"Woodrow, A. W.",A method for measuring relative humidity by means of thermocouples,Journal of Economic Entomology,,,,,1934,618–624,,3,27,,,,English,,,,,,
1711,RLCTZ7GV,journalArticle,1935,"Stauffer, R. S.","Influence of parent material on soil character in a humid, temperate climate",Journal of the American Society of Agronomy,,,,,1935,885–894,,11,27,,,,English,,,,,,
1712,FE8F2DYX,journalArticle,1935,"Wright, R. C.; Lauritzen, J. I.; Whiteman, T. M.",Influence of storage temperatures and humidity on keeping qualities of onions and onion sets,Technical Bulletin of the U.S. Department of Agriculture,,,,,1935,1–37,,,475,,,,English,,,,,,
1713,DIDG427F,journalArticle,1935,"Davies, W. M.",Studies on aphides infesting the potato crop. III. Effect of variation in relative humidity on the flight of Myzus Persicae Sulz,Annals of Applied Biology,,,,,1935,106–115,,1,22,,,,English,,,,,,
1714,KJR7LXQT,journalArticle,1934,"Quayle, H. J.; Rohrbaugh, P. W.",Temperature and Humidity in Relation to HCN Fumigation for the Red Scale,Journal of Economic Entomology,,10.1093/jee/27.5.1083,,,1934,1083–1095,,,27,,,,English,,,,,,
1715,WB282ILR,journalArticle,1934,"Lund, H. O.",Some temperature and humidity relations of the two races of Trichogramma Minutum Riley (Hym. Chelcididae),Annals of the Entomological Society of America,,,,,1934,324–340,,2,27,,,,English,,,,,,
1716,DSIS86HV,journalArticle,1934,"Sibinga, E. S.",Correlation between rainfall and sugar production of P.O.J. 2878,Archief voor de suikerindustrie in Nederlandsch-Indië,,,,,1934,365–369,,12,42,,,,,,,,,,
1717,YZJQWS4C,journalArticle,1934,"Montes, J. G.",Test of a index or measure of rainfall in relation to agriculture,Revista de la Sociedad Cubana de Ingenieros,,,,,1934,14–56,,1,26,,,,,,,,,,
1718,8Z6URJP5,journalArticle,1935,"Jovino, S.",The influence of spring rains on Italian agriculture,Italia agricola,,,,,1935,797–804,,1,77,,,,Italian,,,,,,
1719,L472FNGR,journalArticle,1933,"Keller, B.",Über den anatomischen Bau dürre‐ und hitzeresistenter Blatter [On the anatomical structure of drought – and heat – resistant leaves],Berichte der deutschen Botanischen Gesellschaft,,https://doi.org/10.1111/j.1438-8677.1934.tb01031.x,,,1933,514–522,,10,51,,,,German,,,,,,
1720,KDSMLAAH,journalArticle,1950,"Armand, D. L.",Opyt matematicheskogo analiza sviâzi mezhdu tipami rastitel’nosti i klimatom [Attempt at a mathematical analysis of the connection between vegetation and climate],Izvestiya Vsesoyuznyî Geograf. Obshchestvo S. S. S. R.,,,,,1950,19-49,,1,82,,,,Russian,,WB 00003,,,,
1721,CYLIBGGK,journalArticle,1933,"Dhar, N. R.; Ram, A.",Photosynthesis in tropical sunlight VI: The presence of formaldehyde in rain water,Journal of Physical Chemistry,,10.1021/j150346a015,,,1933,525–531,,4,37,,,,English,,,,,,
1722,H3FG6MJM,journalArticle,1935,"Fraps, G. S.; Sterges, A. J.",Effect of sunlight on the nitrification of Ammonium salts in soils,Soil Science,,,,,1935,85–94,,2,39,,,,English,,,,,,
1723,SGLDWPQ9,journalArticle,1935,"Hopkins, E. W.",The effect of long and short day and shading on nodule development and composition of the soybean,Soil Science,,,,,1935,297–320,,4,39,,,,English,,,,,,
1724,ZEWC9DWA,journalArticle,1934,"Flint, L. H.",Light in relation of dormancy and germination in lettuce seed,Science,,10.1126/science.80.2063.38-a,,,1934,38–40,,2063,80,New Series,,,English,,+ WB 01115,,,,
1725,Z6KNXABX,journalArticle,1935,"Pearson, G. A.",Relation of sunlight to rate of growth,Journal of Forestry,,,,,1935,630–631,,6,33,,,,English,,,,,,
1726,4YL73QJA,journalArticle,1934,"Mather, K.; Anderson, G.",The determination of winter-hardiness in oats,Journal of Agricultural Science,,,,,1934,627–635,,4,24,,,,English,,,,,,
1727,XDGRUGPG,journalArticle,1935,"Clark, J. E.; Margary, I. D.; Cave, C. J. P.","Report on the phenological observations in the British isles from December, 1933, to November, 1934",Quarterly Journal of the Royal Meteorological Society,,10.1002/qj.49706126002,,,1935,231–284,,260,61,,,,English,,,,,,
1728,JSHCQQ3I,journalArticle,1934,"Clark, J. E.; Margary, I. D.; Cave, C. J. P.","Report on the phenological observation in the British Isles from December, 1932, to November, 1933",Quarterly Journal of the Royal Meteorological Society,,10.1002/qj.49706025502,,,1934,197–250,,255,60,,,,English,,,,,,
1729,XAQ8H5DG,journalArticle,1936,"Hackbarth, J.",Studies in photoperiodism III: The photoperiod reaction of some Lupin species,Der Züchter: Zeitschrift für theoretische und angewandte Genetik,,10.1007/BF01812257,,,1936,81–92,,4,8,,,,German,,,,,,
1730,PNRICJVE,report,1934,"Darrow, G. M.; Walde, G. F.",Responses of strawberry varieties and species to duration of the daily light period,,,,,,1934,32,,,,,,,English,Technical Bulletin of the U.S. Department of Agriculture,+ WB 01456,,,,453
1731,IP6USWTR,report,1934,"Gray, G. F.",Relation of light intensity to frutit setting in the sour cherry,,,,,,1934,,,,,,,,English,Technical Bulletin of the Michigan Agricultural Experiment Station,,,,,136
1732,5CTK99RF,book,1935,"Flint, L. H.; McAllister, E. D.",Wave lengths of radiation in the visible spectrum inhibiting the germination of light-sensitive lettuce seed,,,,,,1935,,11,,94,Miscellaneous Collections of the Smithsonian Institution,,,English,,+ WB 01756,,,,
1733,QTECZ2JB,journalArticle,1932,"Hawkins, S.",Some effects of lightning on tomato plants,Proceedings of the Maryland Academy of Science,,,,,1932,57–59,,,48,,,,English,,,,,,
1734,XCV98HQE,journalArticle,1934,"Chesley, L. C.",The effect of radiation upon cell respiration,Biological Bulletin,,,,,1934,259–272,,2,67,,,,English,,,,,,
1735,KNKTET9Y,report,1936,"Burns, G. R.",Further studies of the limits of photosynthesis,,,,,,1936,,,,,,,,English,Bulletin of the Vermont Agricultural Experiment Station,,,,,402
1736,E7JUGH6X,magazineArticle,1935,"Post, K.",Effect of day length on bud formation noted in Cornell tests,Florists' Review,,,,,1935,10–12,,1987,77,,,,English,,,,,,
1737,PKLEAJQT,journalArticle,1933,"Elvez, A. E.",Growth promoting substance and illumination,Proceedings of the National Academy of Science,,,,,1933,636–638,,6,19,,,,English,,,,,,
1738,BIUT5FIG,journalArticle,1935,"Orcutt, F. S.; Fred, E. B.",Light intensity as an inhibiting factor in the fixation of atmospheric nitrogen by Manchu soybeans,Journal of the American Society of Agronomy,,,,,1935,550–558,,7,27,,,,English,,,,,,
1739,6K8YQ5A5,journalArticle,1934,"Post, K.",The effect of day length and light intensity on vegetative growth and flowering of the China aster (Callistephus chinensis),Proceedings of the American Society for Horticultural Science,,,,,1934,626–630,,,31,,,,English,,,,,,
1740,3C4ZWYAN,journalArticle,1934,"Laurie, A.; McElwee, E. W.",Reduction of daylight period on asters,Proceedings of the American Society for Horticultural Science,,,,,1934,615–616,,,31,,,,English,,,,,,
1741,VFZQC64C,journalArticle,1934,"Boswell, V. R.","A study of the temperature, day length, and development interrelationships of spinach varieties in the field",Proceedings of the American Society for Horticultural Science,,,,,1934,549–557,,,31,,,,English,,,,,,
1742,QQTX2UBI,journalArticle,1934,"Dexter, S. T.",Salt concentration and reversibility of ice-formation as related to the hardiness of winter-wheat,Plant Physiology,,,,,1934,601–618,,3,9,,,,English,,,,,,
1743,2IIN5TSE,journalArticle,1935,"Greathouse, G. A.",Unfreezable and freezable water equilibrium in plant tissues as influenced by sub-zero temperatures,Plant Physiology,,,,,1935,781–788,,4,10,,,,English,,,,,,
1744,UCIC2653,journalArticle,1935,"Hopkins, J. W.",Weather and wheat yields in western Canada,Canadian Journal of Research,,,,,1935,306–334,,3,12,,,,English,,,,,,
1745,JPJZ5MKH,report,1936,"Steyaert, R. L.",Studies of the meteorological factors governing the infestation of cotton by Rhizoctonia solani Kühn,,,,,,1936,,,,,,,,French,Publications de l'Institut National pour l'Étude Agronomique du Congo Belge,,,,,7
1746,MP52DM2G,journalArticle,1935,"Berce, R.; Wilbaux, R.",Recherche statistique des relations existant entre le rendement des plantes de grande culture et les facteurs météorologiques en Belgique [Relation of yield of field crops to meteorological factors in Belgium],Bulletin de l’Institut Agronomique de l’État et des Stations de Recherches de Gembloux,,,,,1935,32–81,,1,4,,,,French,,+ WB 00021,,,,
1747,TBFYFC53,journalArticle,1934,"Lecrenier, A.",Winter treatment of fruit trees,Annales de Gembloux,,,,,1934,253–269,,7,40,,,,French,,,,,,
1748,GE457V8V,journalArticle,1936,Depardon; Buron,On the comparative wheat harvests at Beauce and Le Perche,Comptes rendus hebdomadaires des séances de l'Académie d'agriculture de France,,,,,1936,614–620,,,22,,,,French,,,,,,
1749,34ZTJN8F,journalArticle,1934,"Montlaur, L.",Le climat et les besoins physiques de la plante. Moyen de les comparer [The climate and physical requirements of plants. Procedures of their comparison],Comptes rendus hebdomadaires des séances de l'Académie des sciences,,,,,1934,464–466,,,199,,,,French,,+ WB 00876,,,,
1750,E3LUPKMC,journalArticle,1934,"Manzoni, L.; Puppo, A.",Sur la transpiration de blé en fonction des facteurs du climat [The transpiration of wheat as a function of the climatic factors],Comptes rendus hebdomadaires des séances de l'Académie des sciences,,,,,1934,1066–1068,,11,198,,,,French,,,,,,
1751,2BMF8ATK,report,1936,"Bayfield, E. G.","The influence of climate, soil and fertilizers upon quality of soft winter wheat",,,,,,1936,,,,,,,,English,Bulletin of the Ohio Agricultural Experiment Station,,,,,563
1752,6SAJ58YN,report,1935,Anonymous,Winter injury to fruit and nut varieties in New York State,,,,,,1935,,,,,,,,English,Circular of the New York Agricultural Experiment Station,,,,,156
1753,DWI7YTTC,report,1934,"Collison, R. C.; Harlam, J. D.",Winter injury of Baldwin apple trees and its relation to previous tree performance and nutritional treatment,,,,,,1934,,,,,,,,English,New York State Agricultural Experiment Station (Geneva) Bulletin,,,,,647
1754,FRP7Y25P,journalArticle,1935,"Roeser, J.",Climatic factors following forest planting in the Nebraska sandhills,Journal of the Colorado-Wyoming Academy of Science,,,,,1935,42,,1,2,,,,English,,,,,,
1755,3PJJAJNZ,journalArticle,1935,"Rose, J. K.","Corn yield, climate and statistical method in the Corn Belt",Bulletin of the American Meteorological Society,,,,,1935,66,,3,16,,,,English,,,,,,
1756,LDNUYTXR,journalArticle,1934,"Dorsey, M. J.",Ice formation in the fruit bud of the peach,Proceedings of the American Society for Horticultural Science,,,,,1934,22–27,,,31,,,,English,,,,,,
1757,LWZW3SIS,journalArticle,1933,"Mack, W. B.; Livingston, B. E.",Relation of oxygen pressure and temperature to the influence of ethylene on carbon dioxide production and on shoot elongation in very young wheat seedlings,Botanical Gazette,,,,,1933,625–687,,4,94,,,,English,,,,,,
1758,XK2KBBUF,journalArticle,1935,"Visher, S. S.",Climatic effects of the proposed wooded shelter belt in the Great Plains,Annals of the Association of American Geographers,,,,,1935,63–73,,2,25,,,,English,,,,,,
1759,PD2WYE2W,journalArticle,1934,"Heybrock, W.",The interval between tree and pasture lines and the position of their extremes,Geographical Review,,,,,1934,444–452,,,24,,,,English,,,,,,
1760,FK54RD5G,journalArticle,1934,"Morris, W. G.",Lightning storms and forest fires on the national forests of Oregon and Washington,Monthly Weather Review,,,,,1934,370–375,,10,62,,,,English,,,,,,
1761,Z69EPNUX,journalArticle,1934,"Stevens, W. R.",Meteorological conditions preceding thunderstorms on the national forests. 1. Western and central Oregon,Monthly Weather Review,,10.1175/1520-0493(1934)62<366:MCPTOT>2.0.CO;2,,,1934,366–370,,10,62,,,,English,,,,,,
1762,PF6YGXE2,journalArticle,1934,"Watson, A. N.",Further studies on the relation between thermal emissivity and plant temperature,American Journal of Botany,,,,,1934,605–609,,10,21,,,,English,,,,,,
1763,DY9JN5VN,journalArticle,1930,"Arthur, J. M.; Guthrie, J. D.; Newell, J. M.",Some effects of artificial climates on the growth and chemical composition of plants,American Journal of Botany,,10.2307/2435930,,,1930,416–482,,5,17,,,,English,,+ WB 01301; + WB 01879,,,,
1764,GRJQQVHD,journalArticle,1933,"Sears, P. B.",Climatic change as a factor in forest succession,Journal of Forestry,,,,,1933,934–942,,8,31,,,,English,,,,,,
1765,KY3AA89X,journalArticle,1933,"Hopkins, J. W.",Influence of weather conditions on the growth and yield of wheat,Reports of the National Research Council of Canada,,,,,1933,28,,,16,,,,English,,,,,,
1766,6Y8EAK4T,journalArticle,1934,"Grandfield, C. O.","The effect of the time of cutting and of winter protection on the reduction of stands on Kansas Common, Grimm, and Turkestan alfalfas",Journal of the American Society of Agronomy,,,,,1934,179–188,,3,26,,,,English,,,,,,
1767,BZUQNE4Q,journalArticle,1931,"Willard, C. J.",The moisture content of forage at different times in the day,Journal of the American Society of Agronomy,,,,,1931,853–859,,11,23,,,,English,,,,,,
1768,EGY5WGFY,journalArticle,1933,"Cannon, W. A.; Demaree, D.; Purer, E. A.","Evaporation, transpiration and oxygen consumption by roots",Science,,,,,1933,388–389,,2026,78,,,,English,,,,,,
1769,ELPJIIKX,journalArticle,1934,"French, C. S.; Kohn, H. I.; Tany, P. S.",Temperature characteristics for the metabolism of Chlorella. II. The rate of respiration of cultures of Chlorella pyrenoidosa as a function of time and of temperature,Journal of General Physiology,,,,,1934,193–207,,2,18,,,,English,,,,,,
1770,KBV8P6J6,journalArticle,1935,"Ensign, M. R.",Factors influencing the growth and yield of potatoes in Florida,Plant Physiology,,,,,1935,465–482,,3,10,,,,English,,,,,,
1771,Z7I6XVJC,journalArticle,1934,"Clements, H. F.",Significance of transpiration,Plant Physiology,,,,,1934,165–172,,1,9,,,,English,,,,,,
1772,I7LGE7XQ,journalArticle,1936,"Bane, W. A.",Investigations of frost damage to horticultural crops with suggestions for future work [1936],Journal of the Ministry of Agriculture,,,,,1936,1212–1218,,12,42,,,,English,,,,,,
1773,JY6ULQK6,report,1934,"Bureau of Meteorology, Melbourne",Frost risks and frost forecasting,,,,,,1934,,,,,,,,,,,,,,
1774,GXP63H9X,journalArticle,1933,"Maclagan, J. F. A.",Date of Flowering as Affected by Climatic Temperature,Plant Physiology,,,,,1933,395–423,,3,8,,,,English,,,,,,
1775,9DKBE5DI,journalArticle,1933,"Dexter, S. T.",Effect of several environmental factors on the hardening of plants,Plant Physiology,,,,,1933,123–139,,1,8,,,,English,,,,,,
1776,E6PKHD35,journalArticle,1932,"Greathouse, G. A.","Effects of physical environment on the physico-chemical properties of plant saps, and the relation of these properties to leaf temperature",Plant Physiology,,,,,1932,349–390,,3,7,,,,English,,,,,,
1777,7XKHZNIU,journalArticle,1935,"Smith, L. W.; Hussain, M.","A study of the effect of the climatic seasons on certain phases of sheep husbandry at the government cattle farm, Hissar",Agriculture and Livestock in India,,,,,1935,126–138,,2,5,,,,English,,,,,,
1778,3AGIDVQ5,journalArticle,1936,"Kalamkar, R. J.; Gadre, K. M.",Precision observations on weather and crops,Current Science,,,,,1936,645–646,,9,4,,,,English,,+ WB 00818,,,,
1779,A8AHFPKU,journalArticle,1936,"Kalamkar, R. J.",Influence of weather and prices on the cotton crop of the Bombay Presidency,Current Science,,,,,1936,484–486,,7,4,,,,English,,+ WB 00817,,,,
1780,K7U84AWZ,journalArticle,1935,"Prescott, E. E.; Brown, D. D.",Prevention of frost damage: heating in orchards,"Journal of the Department of Agriculture, Victoria",,,,,1935,17–22,,1,33,,,,English,,,,,,
1781,5YH63IMU,journalArticle,1935,"Beruldsen, E. T.",Irrigated pastures: rate and frequency of watering tests,"Journal of the Department of Agriculture, Victoria",,,,,1935,67–74,,,33,,,,English,,,,,,
1782,BM9CZVNH,journalArticle,1936,"Maltais, J. B.",A new recording rain gauge,Scientific Agriculture,,,,,1936,495–498,,9,16,,,,English,,,,,,
1783,H8NQE49L,journalArticle,1935,"Ribbey, R. O.",The influence of environment upon the germination of weed seeds,Scientific Agriculture,,,,,1935,141–150,,3,16,,,,English,,,,,,
1784,PDPVUX3M,journalArticle,1935,"Blair, D. S.",Winter injury to apple trees in Eastern Canada 1933–35,Scientific Agriculture,,,,,1935,8–15,,1,16,,,,English,,,,,,
1785,JMGI34NS,bookSection,1933,"Shaw, W. N.",The book of the growers' year,Reports of the Conference on Agricultural Meteorology in London,,,,,1933,1–10,,,,,,,English,,,,,,
1786,LXJFKWZ7,journalArticle,1935,"Hopkins, J. W.",Influence of weather conditions on the nitrogen content of wheat,Canadian Journal of Research,,,,,1935,228–237,,2,12,,,,English,,,,,,
1787,LXRXRDIQ,journalArticle,1933,"Lamour, R. K.; Mallock, J. K.; Geddes, W. F.",The effect of winter exposure in the stock on quality of wheat,Canadian Journal of Research,,,,,1933,252–260,,3,9,,,,English,,,,,,
1788,9MJVYMVH,journalArticle,1934,"Bowie, E. H.",Meteorological factors that determine forest-fire hazard in Pacific countries,Proceedings of the 5th Pacific Science Congress (Canada) 1933,,,,,1934,1659–1664,,,3,,,,English,,,,,,
1789,V5VVIVMB,journalArticle,1935,"Shutt, F. T.",The nitrogen-content of wheat as affected by seasonal conditions,Transactions of the Royal Society of Canada. Section 3,,,,,1935,37–39,,,29,,,,English,,,,,,
1790,4LSHYHQD,journalArticle,1936,Anonymous,Effect of fog upon plant growth,Nature,,10.1038/137370a0,,,1936,370,,3461,137,,,,English,,,,,,
1791,S2NDLRRL,journalArticle,1936,Anonymous,Degrees of frost,Nature,,10.1038/137180a0,,,1936,180,,3457,137,,,,English,,,,,,
1792,TGA9FFR7,journalArticle,1935,"Wilson, P. W.",Effect of Pressure of Atmosphere on Development of Red Clover,Nature,,0.1038/136262b0,,,1935,262–263,,,136,,,,English,,,,,,
1793,5GSQJ6RJ,journalArticle,1936,"Yates, F.",Crop estimation and forecasting: indications of the sampling observations on wheat,Journal of the Ministry of Agriculture,,,,,1936,156–162,,2,43,,,,English,,,,,,
1794,JX9RG8GI,journalArticle,1936,"Hoare, A. H.",Orchard heating,Journal of the Ministry of Agriculture,,,,,1936,1218–1220,,12,42,,,,English,,,,,,
1795,CSLQPFKJ,journalArticle,1935,"Ware, K. M.",Mushroom-growing in the United States,Journal of the Ministry of Agriculture,,,,,1935,113–119,,2,42,,,,English,,,,,,
1796,T62ZMWVU,journalArticle,1932,"Davidson, D. W.",Effects of climate and soil on the yielding capacity of seed potatoes,"Journal of the Department of Agriculture, Dublin",,,,,1932,199–202,,2,31,,,,English,,,,,,
1797,3EEJKNXB,bookSection,1934,"Bilham, E. G.",Evaporation: a review of methods and results,Report of the Agricultural Meteorological Conference in London,,,,,1934,5–13,,,,,,,English,,,,,,
1798,T9DPPS2M,bookSection,1934,"Hall, A. D.",Why things grow,Reports of the Conference on Agricultural Meteorology in London,,,,,1934,3–4,,,,,,,English,,,,,,
1799,GM58N9QG,bookSection,1934,"Shaw, W. N.",Further development of the growers' year: a daylight calendar,Reports of the Conference on Agricultural Meteorology in London,,,,,1934,2,,,,,,,English,,,,,,
1800,THJL93TA,journalArticle,1936,"Reinecke, O. S. H.",Environment and its influence upon deciduous fruit production,Journal of Pomology and Horticultural Science,,,,,1936,164–174,,2,14,,,,English,,,,,,
1801,6AP9RT7A,book,1935,"Kirkpatrick, T. W.",Studies of the ecology of coffee plantations in East Africa. I. – The climate and eco-climate of coffee plantations,,,,,,1935,,,,,,Crown Agents for Colonies,London,English,,,,,,
1802,QRYVW5VH,journalArticle,1935,"Brenchley, W. E.",The influence of season and of the application of lime on the botanical composition of grassland herbage,Annals of Applied Biology,,,,,1935,183–207,,2,22,,,,English,,,,,,
1803,SATNCJHA,journalArticle,1934,"Garcia Mata, C.; Shaffner, F. I.",Solar and economic relationships,Quarterly Journal of Economics,,,,,1934,1–51,,1,49,,,,English,,,,,,
1804,F2MA7CWK,journalArticle,1935,"Moreau, R. E.",Some eco-climatic data for closed evergreen forest in tropical Afria,Zoological Journal of the Linnean Society,,10.1111/j.1096-3642.1935.tb00073.x,,,1935,285–293,,265,39,,,,English,,,,,,
1805,UK6PDT28,journalArticle,1936,"Coles, R.",Egg quality: the influence of climate and soil,Journal of the Ministry of Agriculture,,,,,1936,317–332,,4,43,,,,English,,,,,,
1806,S4DKDN9I,report,1936,"Lebuja, M.",Climate and sheep,,,,,,1936,,,,,,,,,Tacubaya. Serv. Met. Sec. Clim. Foll.,,,,,5
1807,DVEELN4U,journalArticle,1936,"Bua, G",Five years of bio-climatical observations of olive flies,Meteorologia pratica,,,,,1936,112–126,,,17,,,,Italian,,,,,,
1808,HQQUP8U9,journalArticle,1936,"Rocchi, M.",Effects of meteorological factors on the development and distribution of the olive fly,Meteorologia pratica,,,,,1936,103–111,,,17,,,,Italian,,,,,,
1809,HIABUE4L,journalArticle,1934,"Bua, G",Meteorological factors and the olive fly,Meteorologia pratica,,,,,1934,129–138,,,15,,,,Italian,,,,,,
1810,8CZDB5PK,journalArticle,1935,"Davidson, J.",Some aspects of climate and insect ecology,Journal of the Australian Institute of Agricultural Science,,,,,1935,105–108,,3,1,,,,English,,,,,,
1811,PUALWIL5,journalArticle,1936,"Hemming, F.",The value of meteorology in anti-locust work,O.M.I. Pub.,,,,,1936,299–302,,,24,,,,,,,,,,
1812,BIDDTSKJ,journalArticle,1935,"Gonzalez, S. S.",Progress report on a study of the relation of weather conditions to the development and abundance of the coconut leaf miner and its parasites,Phillippine Journal of Agriculture,,,,,1935,365–386,,4,6,,,,English,,,,,,
1813,XUXQNCRB,journalArticle,1935,"Smith, J. H.",The pinhole borer of North Queensland cabinet woods; Climatic factors,Queensland Agricultural Journal,,,,,1935,9–17,,1,44,,,,English,,,,,,
1814,U349LDXM,journalArticle,1934,"Seamans, H. L.",An insect weather prophet,Reports of the Quebec Society for the Protection of Plants 1932–34,,,,,1934,111–117,,,,,,,,,,,,,
1815,EJKYCCLN,journalArticle,1935,"Ayyar, T. V. R.; Anantanarayanan, H. P.",Agricultural meteorology in its relation to insects pests,Madras Agricultural Journal,,,,,1935,328–335,,8,23,,,,English,,,,,,
1816,RSJ3EDXR,report,1934,"Williams, C. B.",Field studies in the relation of insect pests to climatic conditions,,,,,,1934,111–117,,,,,Empire Cotton Growing Corporation,,English,Reports of the 2nd Conference on Cotton Growing Problems,,,,,
1817,AE7CQEI9,journalArticle,1935,"Bransen, T. E.",Observations on winter survival of pea aphid eggs,Journal of Economic Entomology,,,,,1935,1030–1036,,6,28,,,,English,,,,,,
1818,PW4WQUKD,journalArticle,1935,"Webster, R. L.",Codling moth and the weather,Journal of Economic Entomology,,,,,1935,956–960,,6,28,,,,English,,,,,,
1819,8VE3T36D,journalArticle,1935,"Fox, H.",Some misconceptions regarding the effects of the cold of February 1934 on the larvae of the Japanese beetle (Popillia Japonica Newman),Journal of Economic Entomology,,10.1093/jee/28.1.154,,,1935,154–159,,1,28,,,,English,,,,,,
1820,7ZZ6KX8Z,journalArticle,1936,"Rocchi, M.",Effects of meteorological factors on the development of blight. II. Critical period in wheat in respect of blight,Meteorologia pratica,,,,,1936,58–65,,,17,,,,Italian,,,,,,
1821,34X7MPHE,journalArticle,1935,"Van Everdingen, E.",On the relation between weather and potato diseases,Bioklimatische Beiblätter der Meteorologischen Zeitschrift,,,,,1935,111–116,,,2,,,,German,,,,,,
1822,FI9HVAU2,journalArticle,1932,"Dufrénoy, J.",The meteorological conditions which permit infection of potatoes by Phytophthora infestans,Compte Rendu de la Association Française pour l'Avancement des Sciences,,,,,1932,250–251,,,56,,,,French,,,,,,
1823,ZJBCLNWV,journalArticle,1935,"Foex, E.",Some diseases which have attacked crops during a mild and damp winter,Comptes rendus hebdomadaires des séances de l'Académie d'agriculture de France,,,,,1935,196–198,,5,21,,,,French,,,,,,
