,Key,Item Type,Publication Year,Author,Title,Publication Title,ISSN,DOI,Url,Abstract Note,Date,Pages,Num Pages,Issue,Volume,Series,Publisher,Place,Language,Type,Archive,Library Catalog,Extra,Manual Tags,Number
2488,3JR5892X,journalArticle,1919,"Ward, R. D.",The larger relations of climate and crops in the United States,Quarterly Journal of the Royal Meteorological Society,,,,,1919,1–16,,,45,,,,English,,WB 00977,,,,
2489,DH6LAEI5,journalArticle,1925,"Wardle, R. A.",The climate of the Southern Sudan in relation to cotton growing,Memoirs and proceedings of the Manchester Literary & Philosophical Society,,,,,1925,59–69,,6,70,,,,English,,WB 00978,,,,
2490,YX2D99KG,journalArticle,1928,"Weickmann, L.",Parallélisme des caractères du temps et de la valeur des récoltes [Parallelism of weather types and crop value],Compte Rendu de la Association Française pour l'Avancement des Sciences,,,,,1928,175–181,,,52,,,,French,,WB 00980,,,,
2491,J8UCG6DN,journalArticle,1938,"Webber, H. J.",Influence of environment on citrus,California Citrograph,,,,,1938,"108, 126, 130",,3,23,,,,English,,WB 00979,,,,
2492,CSIZMQ4Y,journalArticle,1929,"Werner, H. O.",Relative productivity of seed potatoes grown under various controlled environmental conditions,Journal of Agricultural Research,,,,,1929,405–410,,7,38,,,,English,,WB 00981,,,,
2493,FNYJQBCR,book,1927,"Werth, E.",Klima- und Vegetations-Gliederung in Deutschland [Climate and vegetation classification in Germany],,,,,,1927,,40,,,Mitteilungen aus der Biologischen Reichsanstalt für Land- und Forstwirtschaft,,,German,,WB 00985,,,,
2494,EZJBSSQX,journalArticle,1941,"Werner, H. O.; Dutt, J. O.",Reduction of cracking of late crop potatoes at harvest time by root cutting or vine killing,American Potato Journal,,,,,1941,189–208,,7,18,,,,English,,WB 00984,,,,
2495,K2YCEG7E,journalArticle,1936,"Werner, H. O.",Morphological response of the potato (Solanum tuberosum) to abrupt environmental changes,American Potato Journal,,,,,1936,150–155,,6,13,,,,English,,WB 00982,,,,
2496,P8DNHWPR,book,1941,"Whitson, A. R.",Notes on climate and soil,,,,,,1941,,246,,,,University of Wisconsin Press,Madison,English,,WB 00989,,,,
2497,L4MSM2YN,report,1916,"Whitehouse, W. E.",A study of variation in apples during the growing season,,,,,,1916,13,,,,,,,English,Oregon Agricultural Experiment Station Bulletin,WB 00987,,,,134
2498,EXAG6TQT,report,1912,"Whitson, A. R.; Baker, O. E.",The climate of Wisconsin and its relation to agriculture,,,,,,1912,65,,,,,,,English,Wisconsin Agricultural Experiment Station Bulletin,WB 00990,,,,223
2499,LSCA65FB,report,1928,"Whitson, A. R.; Baker, O. E.",The climate of Wisconsin and its relation to agriculture,,,,,,1928,46,,,,,,,English,Wisconsin Agricultural Experiment Station Bulletin (revised),WB 00991,,,,223
2500,VU4ARLCJ,journalArticle,1925,"Wiggans, C. B.",The influence of certain environmental and cultural conditions on fruit-bud formation of pear and apricot,Journal of Agricultural Research,,,,,1925,865–883,,,31,,,,English,,WB 00992,,,,
2501,EWQZT5ES,bookSection,1902,"Wiley, H. W.",Influence of environment on the chemical composition of plants,U.S. Department of Agriculture Yearbook 1901,,,,,1902,299–318,,,,,,,English,,WB 00993,,,,
2502,J6D4QR2T,journalArticle,1901,"Wren, H. B.",Climate and corn,Monthly Weather Review,"0027-0644, 1520-0493",10.1175/1520-0493(1901)29[8:CAC]2.0.CO;2,http://journals.ametsoc.org/doi/abs/10.1175/1520-0493%281901%2929%5B8%3ACAC%5D2.0.CO%3B2,,1901,8-14,,1,29,,,,English,,WB 00995,Crossref,,,
2503,QRXWQT83,journalArticle,1942,"Yarnell, S. H.",Influence of the environment on the expression of hereditary factors in relation to plant breeding,Proceedings of the American Society for Horticultural Science,,,,,1942,398–411,,,41,,,,English,,WB 00997,,,,
2504,TW9TU2JM,journalArticle,1945,"Zacks, M. B.",Oats and climate in southern Ontario,Canadian Journal of Research (Section C),,,,,1945,45–74,,2,23,,,,English,,WB 00998,,,,
2505,4Y24ZSW6,journalArticle,1946,"Zinkiewicz, W.",Badania nad wartościa przyrostu rocznego drzew dla studiów nad wahaniami klimatycznymi [Researches on the value of the annual increase of tree girth for studies f climatic oscillations],"Roczniki [Yearbooks] Univ. Marii Curie-Sklodowskiej (Lublin), Dzial B. Geograf.",,,,,1946,177–234,,,1,,,,Polish,,WB 00999,,,,
2506,DY2FS5P8,report,1926,"Abbot, C. G.",Influences of sun rays on plants and animals,,,,,,1926,161–173,,,,,,,English,Annual Report of the Smithsonian Institution,WB 01034,,,,
2507,IJG56CA3,journalArticle,1950,"Zurzycki, J.",Investigations on tree lichens in Kraków and its environments,"Materialy do Fizjografii Kraju, Polska Akad. Umiejetności",,,,,1950,1–30,,,24,,,,Polish,,WB 01000,,,,
2508,CP373WXN,journalArticle,1924,"Adams, J.",Does Light Determine the Date of Heading Out in Winter Wheat and Winter Rye?,American Journal of Botany,00029122,10.2307/2435629,http://doi.wiley.com/10.1002/j.1537-2197.1924.tb05797.x,,1924,535,,8,11,,,,English,,WB 01035,Crossref,,,
2509,LKMSLGYJ,journalArticle,1925,"Adams, J.",Some Further Experiments on the Relation of Light to Growth,American Journal of Botany,00029122,10.2307/2435499,http://doi.wiley.com/10.1002/j.1537-2197.1925.tb05845.x,,1925,398,,7,12,,,,English,,WB 01036,Crossref,,,
2510,XY2EZER4,journalArticle,1929,"Alam, M.",The problem of sterility in Indian crops and fruit trees,Agricultural Journal of India,,,,,1929,293–314,,,24,,,,English,,WB 01037,,,,
2511,2IJKTBMA,journalArticle,1930,"Bergann, F.","Untersuchungen über Lichtwachstum, Lichtkrümmung und Lichtabfall bei Avena sativa mit Hilfe monochromatischen Lichtes [Investigations on light growth, light curvature, and light loss in Avena sativa with the aid of monochromatic light]",Planta,"0032-0935, 1432-2048",10.1007/BF01997282,http://link.springer.com/10.1007/BF01997282,,1930,666-743,,4,10,,,,German,,WB 01054,Crossref,,,
2512,IB6Q4GXJ,journalArticle,1927,"Bellair, G.",La lumière dans la vie végétale [Light and plant life],Revue horticole,,,,,1927,351–352,,,20,Nouvelles séries,,,French,,WB 01052,,,,
2513,ZFTPZEPM,journalArticle,1925,"Bates, C. G.",The relative light requirements of some coniferous seedlings,Journal of Forestry,,10.1093/jof/23.11.869,,,1925,869–879,,11,23,,,,English,,WB 01050,,,,
2514,KU8NA3S3,journalArticle,1917,"Bates, C. G.",The rôle of light in natural and artificial reforestation,Journal of Forestry,,10.1093/jof/15.2.233,,,1917,233–239,,,15,,,,English,,WB 01049,,,,
2515,R9KX54CN,journalArticle,1937,"Azzi, Girolamo",Effeto della luna sull'accrescimento e sviluppo della cipolla [Effect of the moon on the development of the onion],Meteorologia pratica,,,,,1937,32–34,,1,18,,,,Italian,,WB 01048,,,,
2516,AAMUKFA2,journalArticle,1936,"Austin, J. P.",Minimum intensity of artificial illumination effective in supplementing the normal photoperiod,"Papers of the Michigan Academy of Science, Arts and Letters",,,,,1936,25–26,,,22,,,,English,,WB 01047; WB 01407,,,,
2517,FNYEIRQQ,thesis,1940,"Ashburn, E. V.",The vertical transfer of radiation through atmospheric temperature inversions,,,,,,1940,,31,,,,Massachusetts Institute of Technology,"Cambridge, Massachusetts",English,M.S. Thesis,WB 01046,,,,
2518,T45R5WW4,journalArticle,1931,"Arthur, J. M.; Stewart, W. D.",Plant growth under shading cloth,American Journal of Botany,,10.1002/j.1537-2197.1931.tb09628.x,,,1931,897,,10,18,,,,English,,WB 01045,,,,
2519,DMTWWIB6,journalArticle,1929,"Arthur, J. M.",Some Effects of Radiant Energy on Plants,Journal of the Optical Society of America,0030-3941,10.1364/JOSA.18.000253,https://www.osapublishing.org/abstract.cfm?URI=josa-18-3-253,,1929,253–263,,3,18,,,,English,,WB 01044,Crossref,,,
2520,FKELPBAD,journalArticle,1924,"Arthur, J. M.",Work to date at Boyce Thompson Institute for plant research on effect of light on plant growth,Transactions of the Illuminating Engineering Society,,,,,1924,995–997,,,19,,,,English,,WB 01043,,,,
2521,4APALDD9,journalArticle,1925,"Ångström, A.",The albedo of various surfaces of ground,Geografiska Annaler,,,,,1925,323–342,,4,7,,,,,,WB 01041,,,,
2522,UCTSRQ5G,journalArticle,1925,"Ångström, A.",On radiation and climate,Geografiska Annaler,,,,,1925,122–142,,,7,,,,,,WB 01040,,,,
2523,KVXBM7Y7,journalArticle,1926,"André, H.",Synthetische Betrachtungen zum rhytmischen Wachstum und zu den Reizbewegungen der Pflanze [Synthetic observations of rhythmical growth and stimulus movements of plants],Biologisches Centralblatt,,,,,1926,97–111,,2,46,,,,German,,WB 01039,,,,
2524,SZYMFQ4K,bookSection,1936,"Anderson, P. J.; Swanback, T. R.; Street, O. E.",Effect of shade cloth on atmospheric conditions,Tobacco substation at Windsor: report for 1935,,,,,1936,607–608,,,,Connecticut Agricultural Experiment Station Bulletin,,,English,,WB 01038,,,,
2525,ANE5EJUW,report,1903,"MacDougal, D. T.",The influence of light and darkness upon growth and development,,,,,,1903,319,,,,,,,English,Memoirs of the New York Botanical Garden,WB 01190,,,,2
2526,I48F9MIR,journalArticle,1901,"MacDougal, D. T.",Critical points in the relation of light to plants,Science,,10.1126/science.13.320.246,,,1901,252,,320,13,New Series,,,English,,WB 01189,,,,
2527,LF7MR6H2,journalArticle,1947,"McCalla, T. M.",Light reflection from stubble mulch,Journal of the American Society of Agronomy,,,,,1947,690–696,,,39,,,,English,,WB 01187,,,,
2528,W8Y8JNS8,journalArticle,1919,"Long, F. L.",The quantitative determination of photosynthetic activity in plants,Physiological Researches,,,https://babel.hathitrust.org/cgi/pt?id=mdp.39015006932506,,1919,277–300,,,2,,,,English,,WB 01183,,,,
2529,JNSHJAK2,journalArticle,1941,"Langham, D. G.",Effect of light on growth habit of plants,Science,"0036-8075, 1095-9203",10.1126/science.93.2424.576-a,http://www.sciencemag.org/cgi/doi/10.1126/science.93.2424.576-a,,1941,576-577,,2424,93,New Series,,,English,,WB 01180,Crossref,,,
2530,JH8LYH4K,journalArticle,1922,"Kraybill, H. R.",Effects of shading some horticultural plants,Proceedings of the American Society for Horticultural Science,,,,,1922,9–17,,,19,,,,English,,WB 01179,,,,
2531,XHTKB3AJ,journalArticle,1949,"Kondrat'ev, K. IĀ.",O raschete effektivnogo izlucheniia zemmoi poverkhnosti [The computation of the effective radiation of the earth's surface],Gosudarst Univ. nauch. Biull.,,,,,1949,6–10,,,24,,,,Russian,,WB 01177,,,,
2532,9TIZLYVI,journalArticle,1908,"Kinzel, W.",Die Wirkung des Lichtes auf die Keimung [The effect of light on germination],Berichte der deutschen Botanischen Gesellschaft,,10.1111/j.1438-8677.1908.tb08037.x,,,1908,105–115,,2,26,,,,German,,WB 01175,,,,
2533,4FB2WMI4,journalArticle,1905,"King, C. A.",Experiment to show that the absence of light alone will prevent the process of photosynthesis,Torreya,,,,,1905,67–68,,4,5,,,,English,,WB 01174,,,,
2534,E89XESRL,journalArticle,1927,"Kestner, O.",Die Sonnenstrahlung im hohen Norden [Solar radiation in the far North],Naturwissenschaften,,,,,1927,879–882,,44,15,,,,German,,WB 01173,,,,
2535,2ZHHS49T,journalArticle,1949,"Kennedy, R. E.",Computation of daily insolation energy,Bulletin of the American Meteorological Society,,,,,1949,208–213,,6,30,,,,English,,WB 01172,,,,
2536,94ZLW4YW,journalArticle,1941,"Kennedy, R. E.",Daily solar radiant energy at the exterior of the atmosphere,Monthly Weather Review,"0027-0644, 1520-0493",10.1175/1520-0493(1941)069<0145:DSREAT>2.0.CO;2,http://journals.ametsoc.org/doi/abs/10.1175/1520-0493%281941%29069%3C0145%3ADSREAT%3E2.0.CO%3B2,,1941,145-145,,5,69,,,,English,,WB 01171,Crossref,,,
2537,Z876XXSA,journalArticle,1924,"Keener, A. E.",A study of the factors concerned in the reddening of leaves of Diervilla lonicera,American Journal of Botany,00029122,10.1002/j.1537-2197.1924.tb05761.x,http://doi.wiley.com/10.1002/j.1537-2197.1924.tb05761.x,,1924,61-77,,2,11,,,,English,,WB 01170,Crossref,,,
2538,74VRB6YQ,journalArticle,1946,"Kalitin, N. N.",Relation between the supply of solar and scattered radiation under different climatic conditions,[Comptes rendu de'l Academie des Sciences d'U.R.S.S.],,,,,1946,205–207,,3,53,N. S.,,,Russian,,WB 01167,,,,
2539,NGHIPAN9,journalArticle,1928,"Ivanov, L.",Solnechnaia radiatsiia kak ekologicheskii faktor [Solar radiation as an ecological factor],"Trudy po prikladnoi botanike, genetike i selektsii [Bulletin of Applied Botany, Genetics, and Plant Breeding]",,,,,1928,345–368,,,18,,,,Russian,,WB 01164,,,,
2540,VEZCZV6B,journalArticle,1945,"Kalitin, N. N.",Summy tepla solnechnoi radiatsii na territori S.S.S.R. [The heat totals of solar radiation in the S.S.S.R.],Priroda [Nature],,,,,1945,37–42,,2,34,,,,Russian,,WB 01166,,,,
2541,YR37EBCP,journalArticle,1948,"Iaroslavtsev, I. N.",Otrazhennaia radiatsiia ot estestvennykh poverkhnostei v Tashkente [Reflection of radiation from natural surfaces in Tashkent],Izvestiya Akademii Nauk S.S.S.R. [Bulletin of the Academy of Sciences of the USSR],,,,,1948,523–530,,,6,Ser. Geograf. i Geofiz.,,,Russian,,WB 01162,,,,
2542,2R2LQXYI,journalArticle,1910,"Irving, A. A.",The Beginning of Photosynthesis and the Development of Chlorophyll,Annals of Botany,,,,,1910,805–818,,96,24,,,,English,,WB 01163,,,,
2543,RU4L8WFP,journalArticle,1943,"Huberman, M. A.","Sunscald of Eastern White Pine, Pinus Strobus L.",Ecology,00129658,10.2307/1930557,http://doi.wiley.com/10.2307/1930557,,1943,456-471,,4,24,,,,English,,WB 01161,Crossref,,,
2544,QFCF69UF,journalArticle,1925,"Huber, B.",Weitere Beobachtungen über verschiedene Dürreresistenzen bei Licht- und Schattenpflanzen [Additional observations on different drought resistances of light and shade plants],Berichte der deutschen Botanischen Gesellschaft,,,,,1925,551–559,,,43,,,,German,,WB 01160,,,,
2545,DUCDQPG3,journalArticle,1916,"Honing, J.",De invloed van het licht op het kiemen van de zaden van verschillende variëteiten van Nicotiana tabacum [The influence of light on the germination of the seeds of different varieties of Nicotiane tabacum],Deli-Proefstation te Medan (Sumatra) – Bulletin,,,,,1916,1–14,,,7,,,,Dutch,,WB 01159,,,,
2546,9P4H62SB,journalArticle,1923,"Hoagland, D. R.; Davis, A. R.","Further experiments on the absorption of ions by plants, including observations on the effect of light",Journal of General Physiology,,,,,1923,47–62,,1,6,,,,English,,WB 01154,,,,
2547,MZC7VV5Z,journalArticle,1928,"Herbert, D. A.",The sun and plant distribution,Queensland Naturalist,,,,,1928,58–66,,,6,,,,English,,WB 01152,,,,
2548,RDNRRFGT,journalArticle,1950,"Hemphill, D. D.; Murneek, A. E.",Light and tomato yields,Proceedings of the American Society for Horticultural Science,,,,,1950,346–350,,,55,,,,English,,WB 01150,,,,
2549,BRW39Z5U,report,1937,"Heinicke, A. J.; Childers, N. F.","The daily rate of photosynthesis, during the growing season of 1935, of a young apple tree of bearing age",,,,,,1937,52,,,,,,,English,Memoirs of the Cornell University Agricultural Experiment Station,WB 01149,,,,201
2550,6YD2W9GJ,journalArticle,1922,"Hearn, G. D.",Relation of sunlight to plant development,Monthly Weather Review,"0027-0644, 1520-0493",10.1175/1520-0493(1922)50<423:ROSTPD>2.0.CO;2,http://journals.ametsoc.org/doi/abs/10.1175/1520-0493%281922%2950%3C423%3AROSTPD%3E2.0.CO%3B2,,1922,423-424,,8,50,,,,English,,WB 01148,Crossref,,,
2551,KH3ZCI4X,journalArticle,1946,"Haurwitz, B.",Insolation in relation to cloud type,Journal of Meteorology,"0095-9634, 0095-9634",10.1175/1520-0469(1946)003<0123:IIRTCT>2.0.CO;2,http://journals.ametsoc.org/doi/abs/10.1175/1520-0469%281946%29003%3C0123%3AIIRTCT%3E2.0.CO%3B2,,1946,123-124,,4,3,,,,English,,WB 01146,Crossref,,,
2552,SAGDG8P7,journalArticle,1948,"Haurwitz, B.",Insolation in relation to cloud type,Journal of Meteorology,"0095-9634, 0095-9634",10.1175/1520-0469(1948)005<0110:IIRTCT>2.0.CO;2,http://journals.ametsoc.org/doi/abs/10.1175/1520-0469%281948%29005%3C0110%3AIIRTCT%3E2.0.CO%3B2,,1948,110-113,,3,5,,,,English,,WB 01147,Crossref,,,
2553,KTH7AA2D,journalArticle,1945,"Haurwitz, B.",Insolation in relation to cloudiness and cloud density,Journal of Meteorology,"0095-9634, 0095-9634",10.1175/1520-0469(1945)002<0154:IIRTCA>2.0.CO;2,http://journals.ametsoc.org/doi/abs/10.1175/1520-0469%281945%29002%3C0154%3AIIRTCA%3E2.0.CO%3B2,,1945,154-166,,3,2,,,,English,,WB 01145,Crossref,,,
2554,NXKU6UZN,journalArticle,1914,"Hasselbring, H.",The effect of shading on the transpiration and assimilation of the tobacco plant in Cuba,Botanical Gazette,,,,,1914,257–286,,4,57,,,,English,,Wb 01144,,,,
2555,EW2UHWGT,journalArticle,1917,"Harvey, R. B.; True, R. H.",The Influence of Light and Chlorophyll Formation on the Minimum Toxic Concentration of Magnesium Nitrate for the Squash,American Journal of Botany,00029122,10.2307/2434972,http://doi.wiley.com/10.1002/j.1537-2197.1917.tb05463.x,,1917,407–410,,7,4,,,,English,,WB 01143,Crossref,,,
2556,JZKXD8AA,journalArticle,1908,"Harshberger, J. W.",The directive influence of light on the growth of forest plants,Proceedings of the Academy of Natural Sciences of Philadelphia,,,,,1908,449–451,,,60,,,,English,,WB 01141,,,,
2557,XV83T744,journalArticle,1926,"Harrington, J. B.",Growing wheat and barley hybrids in winter by means of artificial light,Scientific Agriculture,,,,,1926,125–130,,,7,,,,English,,WB 01140,,,,
2558,AUFN4ZQ7,journalArticle,1937,"Hand, I. F.",Review of United States Weather Bureau solar radiation investigations,Monthly Weather Review,"0027-0644, 1520-0493",10.1175/1520-0493(1937)65<415:ROUSWB>2.0.CO;2,http://journals.ametsoc.org/doi/abs/10.1175/1520-0493%281937%2965%3C415%3AROUSWB%3E2.0.CO%3B2,,1937,415-441,,12,65,,,,English,,WB 01138,Crossref,,,
2559,YDBQ4SC8,journalArticle,1928,"Halma, F. F.; Haas, A. R. C.",Effect of sunlight on sap concentration of citrus leaves,Botanical Gazette,,,,,1928,102–106,,1,86,,,,English,,WB 01135,,,,
2560,XN8WCL69,journalArticle,1926,"Gressle, C. A.",Light and the flowering and fruiting of plants,Florists' Exchange and Horticultural Trade World,,,,,1926,842–843,,10,61,,,,English,,WB 01134,,,,
2561,46JY4S9S,journalArticle,1919,"Gray, J.; Peirce, G. J.",The Influence of Light Upon the Action of Stomata and Its Relation to the Transpiration of Certain Grains,American Journal of Botany,00029122,10.2307/2435124,http://doi.wiley.com/10.1002/j.1537-2197.1919.tb05532.x,,1919,131,,4,6,,,,English,,WB 01133,Crossref,,,
2562,JNYCJ2BC,report,1921,"Gourley, J. H.; Nightingale, G. T.",The effects of shading some horticultural plants. A preliminary report,,,,,,1921,22,,,,,,,English,Technical Bulletin of the New Hampshire Agricultural Experiment Station,WB 01131,,,,18
2563,QIHIPEWH,journalArticle,1920,"Gourley, J. H.",The effect of shading some horticultural plants,Proceedings of the American Society for Horticultural Science,,,,,1920,256–260,,,17,,,,English,,WB 01130,,,,
2564,WS5UGXNV,journalArticle,1919,"Goodspeed, T. H.",Notes on the germination of tobacco seed. III. Note on the relation of light and darkness to germination,University of California publications in botany,,,,,1919,451–455,,16,5,,,,English,,WB 01127,,,,
2565,9YDH3J6Z,journalArticle,1901,"Goff, E. S.",Influence of light on the length of the hypocotyl in Indian corn,Science,"0036-8075, 1095-9203",10.1126/science.13.323.395,http://www.sciencemag.org/cgi/doi/10.1126/science.13.323.395,,1901,395-395,,323,13,New Series,,,English,,WB 01126,Crossref,,,
2566,BC7R3WUG,journalArticle,1925,"Gericke, W. F.",Effect of light on availability of iron to wheat plants in water cultures,Botanical Gazette,,,,,1925,106–108,,1,79,,,,English,,WB 01124,,,,
2567,G4XL7T5H,journalArticle,1921,"Gardner, W. A.",Effect of light on germination of light-sensitive seeds,Botanical Gazette,,,,,1921,249–288,,4,71,,,,English,,WB 01123,,,,
2568,6VH77EWA,journalArticle,1925,"Gane, R.","The carbohydrate content of detached, partially shaded leaves",Proceedings of the Leeds Philosophical and Literary Society. Scientific Section,,,,,1925,497–505,,10,1,,,,English,,WB 01122,,,,
2569,CJAHPFFQ,journalArticle,1950,"Galston, A. W.","Riboflavin, Light, and the Growth of Plants",Science,"0036-8075, 1095-9203",10.1126/science.111.2893.619,http://www.sciencemag.org/cgi/doi/10.1126/science.111.2893.619,,1950,619-624,,2893,111,New Series,,,English,,WB 01120,Crossref,,,
2570,2H6Z53VW,journalArticle,1949,"Fritz, S.",The albedo of the planet earth and of clouds,Journal of Meteorology,"0095-9634, 0095-9634",10.1175/1520-0469(1949)006<0277:TAOTPE>2.0.CO;2,http://journals.ametsoc.org/doi/abs/10.1175/1520-0469%281949%29006%3C0277%3ATAOTPE%3E2.0.CO%3B2,,1949-08,277-282,,4,6,,,,English,,WB 01117,Crossref,,,
2571,ZD3M5A73,journalArticle,1948,"Fritz, S.",The albedo of the ground and atmosphere,Bulletin of the American Meteorological Society,,,,,1948,303–312,,6,29,,,,English,,WB 01116,,,,
2572,YDMXDBLB,journalArticle,1918,"Drude, O.",Licht- und Wärmestrahlung als ökologische Standortsfaktoren [Light and heat radiation as ecological site factors],Flora oder Allgemeine Botanische Zeitung,03671615,10.1016/S0367-1615(17)32847-1,https://linkinghub.elsevier.com/retrieve/pii/S0367161517328471,,1918,227-267,,,111-112,,,,German,,WB 01108,Crossref,,,
2573,AZK25ZYJ,report,1945,"Dunlap, A. A.",Fruiting and shedding of cotton in relation to light and other limiting factors,,,,,,1945,104,,,,,,,English,Texas Agricultural Experiment Station Bulletin,WB 01111,,,,677
2574,7TPT4ID7,book,1919,"Douglass, A. E.",Climatic cycles and tree growth: a study of the annual rings of trees in relation to climate and solar activity,,,,,,1919,,,,,Publications of the Carnegie Institution of Washington,,,English,,WB 01104,,,,
2575,EPGEM9GR,journalArticle,1917,"Doi, T.",Über die Sonnen- und Schattenblätter einiger Bäume,"Journal of the College of Science, Imperial University of Tokyo",,,,,1917,37,,1,40,,,,German,,WB 01103,,,,
2576,22YJSYGP,journalArticle,1919,"De Beseiro, D. C.; Durand, M.",Influence de la lumière sur l'absorption des matières organizues du sol par les plantes [Influence of light on the absorption of organic matter from the soil by plants],Comptes rendus hebdomadaires des séances de l'Académie des sciences,,,,,1919,467–470,,,168,,,,French,,WB 01101,,,,
2577,CLJ8IFR2,journalArticle,1925,"Davy de Virville, A.",Action de la lumière sur les mousses [Action of light on mosses],Comptes rendus hebdomadaires des séances de l'Académie des sciences,,,,,1925,1959–1961,,,180,,,,French,,WB 01100,,,,
2578,8NEKFNEG,journalArticle,1919,"Daniel, L.",Recherches sur le développement comparé de la laitue au soleil et à l'ombre [Research on the comparative development of lettuce in sunlight and in shade],Comptes rendus hebdomadaires des séances de l'Académie des sciences,,,,,1919,694–697,,,168,,,,French,,WB 01098,,,,
2579,S2JUV43V,journalArticle,1920,"Crocker, W.",Light and growth,Botanical Gazette,,,,,1920,243–246,,3,70,,,,English,,WB 01097,,,,
2580,8MDTSNWA,report,1950,"Crabb, G. A., Jr.",Solar radiation investigations in Michigan,,,,,,1950,153,,,,,,,English,Technical Bulletin of the Michigan Agricultural Experiment Station,WB 01095,,,,222
2581,AE4QXQ2J,journalArticle,1925,"Combes, R.",La lumière exerce-t-elle une action directe  sur la décomposition de la chlorophylle des feuilles en automne? [Does light exert a direct influence on the decomposition of chlorophyll of leaves in autumn?],Comptes rendus hebdomadaires des séances de l'Académie des sciences,,,,,1925,120–130,,,181,,,,French,,WB 01094,,,,
2582,FTFJUEW7,journalArticle,1913,"Combes, R.",Influence de l'éclairement sur la formation des graines et sur leur pouvoir germinatif [The effect of lighting on the formation of seeds and their ability to germinate],Revue générale de botanique,,,,,1913,130–141,,,25,,,,French,,WB 01093,,,,
2583,9SSYFMEA,journalArticle,1949,"Coblentz, W. W.","Correlation of bioclimatic ultraviolet and total solar radiation in Washington, D. C. 1941–48",Bulletin of the American Meteorological Society,,,,,1949,204–207,,6,30,,,,English,,"WB 01091, + WB 01737",,,,
2584,MXP43E2P,journalArticle,1905,"Clark, V. A.",Light as a factor in plant culture. The problem stated and its methods of solution,Proceedings of the American Society for Horticultural Science,,,,,1905,24–32,,,2,,,,English,,WB 01089,,,,
2585,C35WPJ7A,journalArticle,1942,"Chandler, D. C.",Limnological Studies of Western Lake Erie: II. Light Penetration and Its Relation to Turbidity,Ecology,00129658,10.2307/1930871,http://doi.wiley.com/10.2307/1930871,,1942,41-52,,1,23,,,,English,,WB 01088,Crossref,,,
2586,T49WMG5J,journalArticle,1938,"Champion, D. L.",Night radiation in the spring of 1938,Meteorological Magazine,,,,,1938,302–303,,875,73,,,,English,,WB 01087,,,,
2587,RRKHPU5V,journalArticle,1934,"Carton, P.","Considerations on the action of light on plants, ecological factors ""intensity of light"" and ""length of day"", ""vernalisation"", particularly for tropical countries",Bulletin de la direction générale de l'instruction publique Indochine,,,,,1934,,,,,,,,French,,WB 01086,,,,
2588,Z5PBZ9MY,journalArticle,1925,"Caldwell, J. S.",Some effects of seasonal conditions upon the chemical composition of American grape juices,Journal of Agricultural Research,,,,,1925,1133–1176,,,30,,,,English,,WB 01085,,,,
2589,V3KTTSID,journalArticle,1926,"Busse, W.",Die Keimung des Tabaksamens in ihren Beziehungen zum Licht [Germination of tobacco seed in its relation to light],Zeitschrift für Botanik,,,,,1926,65–97,,,18,,,,German,,WB 01084,,,,
2590,4FBF7DGT,journalArticle,1948,"Burtch, L. M.; Thorne, D. W.; Wann, F. B.","The effect of light, soil temperature, and soil moisture on high-lime chlorosis",Proceedings of the Soil Science Society of America,,,,,1948,394–398,,,13,,,,English,,WB 01083,,,,
2591,JV76JXYR,journalArticle,1927,"Burns, G. P.",Light on the underbush,Vermont Botany and Bird Clubs Joint Bulletin,,,,,1927,30–32,,,12,,,,English,,WB 01082,,,,
