,Key,Item Type,Publication Year,Author,Title,Publication Title,ISSN,DOI,Url,Abstract Note,Date,Pages,Num Pages,Issue,Volume,Series,Publisher,Place,Language,Type,Archive,Library Catalog,Extra,Manual Tags,Number
805,LHDZ7RJ5,journalArticle,1911,"Hecker, A.","Die Jahreswitterung in ihrem Einfluss auf die Beschaffenheit der Gersten, Kartoffeln und Zuckerrüben",Landwirtschaftliche Jahrbücher,,,,,1911,417,,,41,,,,German,,,,,,
806,MEQKT9DY,journalArticle,1928,"Haupt, W.",Tausendkorngewicht und Witterung in den Jahren 1921 bis 1926,Georgine,,,,,1928,65–66,,10,104,,,,German,,,,,,
807,J56GMTZ7,thesis,1930,"Hadji-Zade, M.",Über die Beziehungen zwischen Witterungsverlauf und der Höhe und Beschaffenheit des Weizenertrages [The relation between weather and the yield and quality of Wheat],,,,,,1930,,,,,,,Berlin,German,Dissertation,,,,,
808,FVDC7WZD,journalArticle,1933,"Groissmayr, F. B.",Beziehungen der Sommerwitterung im nördlichen Alpenvorland mit dem Vorwetter. III. Sommerwitterung und Ernteerträgnis,Meteorologische Zeitschrift,,,,,1933,305,,8,,,,,German,,,,,,
809,ZWH759NB,journalArticle,1934,"Groissmayr, F. B.",Der Einfluss der Junitemperatur auf die Kartoffelernte in Niederbayern,Zeitschrift für angewandte Meteorologie,,,,,1934,153,,5,51,,,,German,,,,,,
810,K5L38VSA,journalArticle,1904,"Grohmann, C.",Der Einfluss der Witterung auf die Erträge der Zuckerrübe nach Menge und Güte,Deutsche Landwirtschaftliche Presse,,,,,1904,83,,11,31,,,,German,,,,,,
811,SCCVXW3T,book,1901,"Grohmann, C.",Die phänologischen Beobachtungen der Jahre 1864–1897 und die Ernteerträge im Königreich Sachsen in ihrer Abhängigkeit von den Witterungsverhältnissen,,,,,,1901,,,,,Das Klima des Königreichs Sachsen,,,German,,,,,,
812,GNC2FIAS,thesis,1930,"Gerlach, J.",Die Beziehungen der Witterungsfaktoren zu den Ernteerträgen im Gebiet zwischen Magdeburg und dem Nordharz,,,,,,1930,,,,,,,Halle,German,Dissertation,,,,,
813,D228FUIN,thesis,1928,"Gösele, L.",Untersuchungen über Beziehungen zwischen Witterung und Ernteertag in der Landwirtschaft,,,,,,1928,,,,,,,,German,Dissertation,,,,,
814,99PLRT6Q,journalArticle,1929,"Fischer, E.",Kartoffelwachstum und Witterung,Die Kartoffel,,,,,1929,83–85,,,,,,,German,,,,,,
815,X5NJ5AEY,thesis,1928,"Fischer, E.",Beitrag zur Kenntnis der Umwelteinflüsse auf die Kartoffel unter besonderer Berücksichtigung der Sorteneigentümlichkeiten,,,,,,1928,,,,,,Landwirtschaftliche Hochschule Berlin,Berlin,German,Dissertation,,,,,
816,ERPEPZAX,journalArticle,1930,Feistritzer,Untersuchungen über den EInfluss klimatischer Faktoren auf dei Entwikclung der einzelnen Ertragskomponenten der Wintergerste,Pflanzenbau,,,,,1930,,,34–36,7,,,,German,,,,,,
817,E2TL6DK6,report,1933,Deutsche Landwirtschafts-Gesellschaft,Berichte der Arbeitsgemeinschaft für die Pflanzensortenrpüfung bei der D.L.G.,,,,,,1933,,,,,,,,German,,,,,,
818,CR24K3T2,journalArticle,1925,"Densch, A.; Hunnius",Der Einfluss des Wassergehalts des Bodens zu verscheidenen Zeiten der Wachsumsperiode auf Ertrag....,Die landwirtschaftlichen Versuchs-Stationen,,,,,1925,,,91,103,,,,German,,,,,,
819,54QUEJZV,journalArticle,1906,"Tuckermann, R.",Beitrag zur Frage des Abbaus der Kartoffeln,Mitteilungen der landwirtschaftlichen Institutes der Königlichen Universität Breslau,,,,,1906,,,55,3,,,,German,,,,,,
820,NFS9EUI9,thesis,1912,"Tornier, R.","Beziehungen zwischen Witterung, Düngung und Bodenertrag",,,,,,1912,,,,,,,Göttingen,German,Dissertation,,,,,
821,23HU6BJH,thesis,1928,"Welker, E.",Die Untersuchungen über die Beziehungen zwischen Klima u. Ernteerträgen in Wttb,,,,,,1928,,,,,,,Hohenheim,German,Dissertation,,,,,
822,P9P9K247,journalArticle,1926,Vageler,Wie beeinflusst die Witterung de Stärkeertrag der Kartoffeln?,Die Kartoffel,,,,,1926,66,,,,,,,German,,,,,,
823,EG53UBJH,journalArticle,1933,"Ufer, M.",Untersuchungen über die den Samenansatz der Luzerne beeinflussenden klimatischen Faktoren,Der Züchter: Zeitschrift für theoretische und angewandte Genetik,,,,,1933,217,,10,5,,,,German,,,,,,
824,ICXQ8MZM,thesis,1931,"Wiechmann, F.",Agrarmeteorologische Untersuchung der Altmark auf Grund der Beziehungen zwischen Witterungsfaktoren und Ernteerträgen,,,,,,1931,,,,,,,Halle,German,Dissertation,,,,,
825,7XCD5CIT,journalArticle,1926,Wiesenberg,Untersuchungen über den Einfluss des Wassergehaltes des Bodens auf den Pflanzenertrag,Botanisches Archiv,,,,,1926,261–285,,,14,,,,German,,,,,,
826,HTNNVDGW,journalArticle,1915,"Wohltmann, F.",Unsere Ernteaussichten für 1915,Deutsche Landwirtschaftliche Presse,,,,,1915,275,,,31,,,,German,,,,,,
827,3KXZKGHK,journalArticle,1932,"Ziegler, O.",Die Bedeutung der Umweltfaktoren für die einzelnen Ertragskomponenten des Einzelfplanzen- und Föächenertrages mit...,Landwirtschaftliche Jahrbücher,,,,,1932,211,,,76,,,,German,,,,,,
828,TMT32CSK,thesis,1929,"Zielke, W.",Untersuchungen über den Einfluss der Witterung auf die Ernten einiger Obstgattungen- u. Sorten in Deutschland,,,,,,1929,,,,,,,Halle,German,Dissertation,,,,,
829,AYBZW3WT,journalArticle,1929,"Rettig, H.",Über den Einfluss der Luftfeuchtigkeit auf die Entwicklung der Pflanzen,Botanisches Archiv,,,,,1929,128–172,,,25,,,,German,,,,,,
830,6WXNRP5N,journalArticle,1932,"Aubert, S.",Pluviosité et boisement à la Vallée de Joux,Journal forestier suisse,,,,,1932,53,,,,,,,French,,,,,,
831,BCVSE6LV,journalArticle,1932,"Burger, Hans",Influence du pâturage sur l'écoulement des eaux et l'érosion,Journal forestier suisse,,,,,1932,97,,4,83,,,,French,,,,,,
832,MUK6HC6Z,journalArticle,1933,"Biolley, H.",Forêt et pluviosité. Un question mal posée,Journal forestier suisse,,10.5169/seals-784964,,,1933,145,,7,84,,,,French,,,,,,
833,YX7Y5H9Y,journalArticle,1932,"Biolley, H.",Forêt et pluviosité,Journal forestier suisse,,10.5169/seals-784775,,,1932,161,,8,83,,,,French,,,,,,
834,S7GIUB54,journalArticle,1934,"Burger, Hans",Unwetterschäden in Wald u. Freiland in der Zentralschweriz,Schweizer Zeitschrift für Forstwesen,,,,,1934,371,,,85,,,,German,,,,,,
835,H56G9B8L,journalArticle,1934,"Burger, Hans",Einfluss des Waldes auf den Stand der Gewässer. II Mitteilung. Der Wasserhaushalt im Sperbel- und Rappengraben von 1915/16 bis 1926/27,Mitteilungen der Schweizerischen Anstalt für das forstliche Versuchswesen,,,,,1934,311,,2,18,,,,German,,,,,,
836,LH3HL225,journalArticle,1934,"Burger, Hans",Verdunstung,Schweizer Zeitschrift für Forstwesen,,,,,1934,183,,,85,,,,German,,,,,,
837,ARUWXRMA,journalArticle,1932,"Burger, Hans",Sturmschaden,Mitteilungen der Schweizerischen Anstalt für das forstliche Versuchswesen,,,,,1932,341,,2,17,,,,German,,,,,,
838,XQ9FD4Z9,journalArticle,1931,"Burger, Hans",Waldklimafragen,Mitteilungen der Schweizerischen Anstalt für das forstliche Versuchswesen,,,,,1931,"7, 153",,1,17,,,,German,,,,,,
839,UKSWA3TF,journalArticle,1932,"Combe, S.",Pluviosité et boisement,Journal forestier suisse,,10.5169/seals-784761,,,1932,112–114,,5,83,,,,French,,,,,,
840,X9UVHNDK,journalArticle,1934,"Ernst, F.",Die Bedeutung der Klimaextreme für den Waldbau in Mitteleuropa,Forstwissenschaftliches Centralblatt,,,,,1934,86,,,,,,,German,,,,,,
841,TRIC6C92,journalArticle,1933,"Guyot, E.; Godet, C.",Influence du climat sur le rendement de la vigne,Bulletin de la Société neuchâteloise des Sciences naturelles,,,,,1933,77–96,,,58,,,,French,,,,,,
842,5VXQIHV8,journalArticle,1934,"Hadorn, C.",Bioclimatologie forestière,Journal forestier suisse,,,,,1934,13–18,,85,,,,,French,,,,,,
843,M2PQSILH,journalArticle,1933,"Hadorn, C.",Les climats de la forêt et la biologie des insectes forestiers,Journal forestier suisse,,,,,1933,49–54,,3,84,,,,French,,,,,,
844,RB5C24AG,journalArticle,1933,"Künkele, T.",Spätfrost und Höhenlage,Forstwissenschaftliches Centralblatt,,,,,1933,577–579,,,55,,,,German,,,,,,
845,NIWEMJUI,journalArticle,1934,"Jungo, J.",Les bris de neige dans la Broye en 1931,Journal forestier suisse,,,,,1934,81–83,,4,85,,,,French,,,,,,
846,HBQ34UGW,book,1932,"Lang, R.",Bedeutung exakter Klimawerte in der Standortslehre,,,,,,1932,,,,,,Silva,,German,,,,,,
847,8HV4J4J5,journalArticle,1933,"Mercanton, P. L.; Stouky, Paul",Le régime pluvial de Cully à la Tour de Gourze,Bulletin de la Société vaudoise des Sciences naturelles,,,,,1933,,,233,58,,,,French,,,,,,
848,K9AM3GQF,journalArticle,1932,"Moreillon, M.",Pluviosité et taux de boisement du Platueau suisse,Journal forestier suisse,,,,,1932,13–19,,1,83,,,,French,,,,,,
849,HU2VSRHX,journalArticle,1932,"Moreillon, M.",Observations météorologiques faites à Montcherand et environs,Bulletin de la Société vaudoise des Sciences naturelles,,,,,1932,,,230,57,,,,French,,,,,,
850,P2HNICP4,journalArticle,1934,"Stähelin, R.",La signification de l'inondation de Los Angeles au point de vue forestier,Journal forestier suisse,,,,,1934,152,,,,,,,French,,,,,,
851,GNZ9WN4G,journalArticle,1932,"Renaud, A.",Forêt et pluviosité,Journal forestier suisse,,10.5169/seals-784784,,,1932,252,,12,83,,,,French,,,,,,
852,S5N9NIA3,journalArticle,1932,"Papajoamou, J.",Die mikroklimatischen Verhältnisse unter Pflanzendecke aus Stoff,Forstwissenschaftliches Centralblatt,,,,,1932,666,,,,,,,German,,,,,,
853,SSFBS3FY,journalArticle,1932,"Nagel, J. L.",Forêt et pluviosité,Journal forestier suisse,,,,,1932,194–195,,8,83,,,,French,,,,,,
854,GF5UYHHJ,journalArticle,1931,"Waldron, L. R.",Frost injury to spring wheat with a consideration of drought resistance,Journal of the American Society of Agronomy,,10.2134/agronj1931.00021962002300080003x,,,1931,625–637,,8,23,,,,English,,,,2B_p1_1,,
855,RUZJUFZY,report,1929,"Quisenberry, K. S.; Clark, J. A.",Breeding hard red winter wheats for winter hardiness and high yield,,,,https://ageconsearch.umn.edu/record/157944/files/tb136.pdf,,1929,28 pp,,,,,United States Department of Agriculture,,English,,,,2B_p1_2,,136
856,IBH3MJC4,journalArticle,1929,"Gericke, W. F.",Some relations of maintained temperature to germination and the early growth of wheat in nutrient solutions,The Philippine Journal of Science,,,,,1929,215–238,,2,38,,,,English,,,,2B_p1_3,,
857,EDLBS8RD,journalArticle,1933,"Reed, C. D.",The relation of June temperature to the maturing of corn in Iowa,Monthly Weather Review,,10.1175/1520-0493(1933)61<43:TROJTT>2.0.CO;2,ftp://ftp.library.noaa.gov/docs.lib/htdocs/rescue/mwr/061/mwr-061-02-0043.pdf,,1933,43–44,,2,61,,,,English,,,,2B_p1_4,,
858,6WPZS7JU,journalArticle,1933,"Reed, C. D.",June temperature indicates corn maturity in Iowa,Bulletin of the American Meteorological Society,,10.1175/1520-0477-14.8-9.199,https://journals.ametsoc.org/doi/pdf/10.1175/1520-0477-14.8-9.199,,1933,199–202,,8–9,14,,,,English,,,,2B_p1_6,,
859,GS7RVI8J,journalArticle,1930,"Mack, W. B.",The relation of temperature and the partial pressure of oxygen to respiration and growth in germinating wheat,Plant Physiology,,,https://www.ncbi.nlm.nih.gov/pmc/articles/PMC440197/pdf/plntphys00513-0007.pdf,,1930,1–68,,1,5,,,,English,,,,,,
860,MPUUBRJE,journalArticle,1932,"Lubimenko, V. N.; Hubbenet, E. R.",The influence of temperature on the rate of accumulation of chlorophyll in etiolated seedlings,New Phytologist,,10.1111/j.1469-8137.1932.tb07431.x,https://nph.onlinelibrary.wiley.com/doi/abs/10.1111/j.1469-8137.1932.tb07431.x,,1932,26–57,,1,31,,,,English,,,,2B_p2_6,,
861,UNKMSTMJ,report,1932,"Magoon, C. A.; Culpepper, C. W.",Response of sweet corn to varying temperatures from time of planting to canning maturity,,,,,,1932,40 pp,,,,,,,English,United States Department of Agriculture Technical Bulletin,,,2B_p2_4,,312
862,LNUTD336,journalArticle,1933,"Hurd-Karrer, A. M.",Comparative responses of a spring and a winter wheat to day lenght and temperature,Journal of Agricultural Research,,,,,1933,867–888,,10,46,,,,English,,+ WB 01519; + WB 01959,,2B_p2_3,US Department of Agriculture,
863,G9G7EGQJ,journalArticle,1933,"Waldron, L. R.",Yield and protein content of hard red spring wheat under conditions of high temperature and low moisture,Journal of Agricultural Research,,,,,1933,129–147,,3,47,,,,English,,,,2B_p2_2,North Dakota Agricultural Experiment Station,
864,ZKH8FXNW,journalArticle,1931,"Newton, R.; Anderson, J. A.",Respiration of winter wheat plants at low temperatures,Canadian Journal of Research,,10.1139/cjr31-074,,"Respiration measurements at −7°, 0° and 7 °C. with four winter wheat varieties and two spring wheat varieties grown in the field, were carried on during the fall and early winter of four years. The rate of respiration in winter wheat decreased as the plants hardened. At the outset all varieties respired about alike. After hardening began, the rates at −7 °C. were in the inverse order of hardiness, with the spring wheats faster than the least hardy winter wheat. As hardening progressed, the differentiation of the winter varieties at −7 °C. became sharper, and could be observed also at 0 °C., but at 7 °C. very little if any relationship of this sort developed. The spring varieties, because of frost damage, could not be compared with winter varieties in the fully hardened condition, but their behavior early in the season confirms the general conclusion that at the freezing point or lower temperatures respiratory activity is inversely related to winter hardiness. This accounts for the observed fact that hardy varieties maintain their sugar reserves better than non-hardy varieties during the winter.",1931,337–354,,3,5,,,,English,,,,2B_p2_1,,
865,F9WPYFGV,journalArticle,1932,"Waldron, L. R.",Differences of injury by frost to wheat plants grown comparably,Journal of the American Society of Agronomy,,10.2134/agronj1932.00021962002400060009x,https://dl.sciencesocieties.org/publications/aj/abstracts/24/6/AJ0240060494/preview,,1932,494–500,,6,24,,,,English,,,,2B_p1_9,,
866,7VQVFWUF,journalArticle,1932,"Smith, W. K.",The effect of different temperatures on the reaction of Hope wheat to bunt,Phytopathology,,,,,1932,615–627,,7,22,,,,English,,,,2B_p1_8,,
867,E7CN992F,journalArticle,1930,"Busse, W. F.",Effect of low temperatures on germination of impermeable seeds,Botanical Gazette,,10.1086/334043,https://www.journals.uchicago.edu/doi/10.1086/334043?mobileUi=0&,"1. Dormancy of seeds due to an impermeable seed coat may often be broken by cooling the seeds to very low temperatures. 2. Impermeable sweet clover and alfalfa seeds may be made permeable without injuring, by freezing the air-dry seeds in liquid air (-190⚬C.). 3. Sweet clover seeds were not injured by keeping them in liquid air for nearly six months (175 days); and rapidly cooling seeds down to -190⚬C. twenty times, followed each time by a very rapid warming, did not injure them. 4. Cooling to -80⚬C. caused most of the impermeable alfalfa seeds to become permeable, but this treatment had very little effect on impermeable sweet clover seeds. 5. Freezing air-dry seeds to very low temperatures had no appreciable effect on their keeping power. 6. The average specific heat of air-dry alfalfa seeds between 20° and -190 °C. is about 0.21 cal. per degree. 7. The process of destroying the impermeability of alfalfa seeds by intense freezing appears to be a practical one for large-scale operations.",1930,169–179,,2,89,,,,English,,+ WB 02428,,2B_p2_7,,
868,3N548JAA,journalArticle,1931,"Shirley, H. L.",The influence of light and temperature upon the utilization by young seedlings of organic reserves in the seed,American Journal of Botany,,10.1002/j.1537-2197.1931.tb04943.x,https://bsapubs.onlinelibrary.wiley.com/doi/10.1002/j.1537-2197.1931.tb04943.x,,1931,717–727,,9,18,,,,English,,,,2B_p2_8,,
869,84Q2URK6,journalArticle,1932,"Smith, O.","Relation of temperature to anthesis and blossom drop of the tomato, together with a histological study of the pistils",Journal of Agricultural Research,,,https://naldc.nal.usda.gov/download/IND43968129/PDF,,1932,183–190,,2,44,,,,English,,,,2B_p3_6,Oklahoma Agricultural Experiment Station,
870,YTSGUGQR,journalArticle,1931,"Wright, R. C.; Pentzer, W. T.; Whiteman, T. M.; Rose, D. H.",Effect of various temperatures on the storage and ripening of tomatoes,United States Department of Agriculture Technical Bulletin,,,,,1931,35 p,,,268,,,,English,,,,2B_p3_5,,
871,4D8WVQYC,journalArticle,1933,"Mac Gillivray, J. H.",Tomato colour as affected by processing temperatures [1933],Reports of the Experimental and Research Station Cheshunt,,,,,1933,1692,,7,7,,,,English,,,,,,
872,AJCPT3MZ,journalArticle,1932,"Mac Gillivray, J. H.",Tomato colour as affected by processing temperatures [1932],Proceedings of the American Society for Horticultural Science,,,,,1932,353–359,,,28,,,,English,,,,2B_p3_2,,
873,LR6IF6GW,report,1932,"Hibbard, R. P.",The various effects of frost protectors on tomato plants,,,,https://babel.hathitrust.org/cgi/pt?id=uiug.30112019642138;view=1up;seq=6,,1932,36p,,,,,,,English,Technical Bulletin of the Michigan Agricultural Experiment Station,,,2B_p3_1,,124
874,Z95SZ994,journalArticle,1932,"Nichols, H. E.; Lantz, H. L.",The persistence of winter injury in certain Delicious hybrids,Proceedings of the American Society for Horticultural Science,,,,,1932,103–106,,,28,,,,English,,,,2B_p2_13,,
875,S6XZ65EH,journalArticle,1932,"Nichols, E. S.",Some phases of fruit-frost work in southern Alabama,Bulletin of the American Meteorological Society,,10.1175/1520-0477-13.2.21b,https://journals.ametsoc.org/doi/pdf/10.1175/1520-0477-13.2.21b,,1932,21–24,,2,13,,,,English,,,,2B_p2_11; 2B_p13_3,,
876,KE9C56VE,journalArticle,1930,"Lommel, W. E.; Greene, L.",Some effects of late spring frosts upon the viability of apple pollen,Proceedings of the American Society for Horticultural Science,,,,,1930,404–405,,,27,,,,English,,,,2B_p2_10,,
877,6FDPBE3E,journalArticle,1930,"Hansen, N. E.",Fruit stocks where the mercury freezes,Report and Proceedings of the 9th International Horticultural Congress in London,,,,,1930,307–311,,,,,,,English,,,,2B_p3_7,,
878,PMDSLLD8,journalArticle,1931,"Tindale, G. B.","Blue and green moulds of oranges. Sources of methods of infection, together with a study of temperature in relation to infection periods","The Journal of the Department of Agriculture, Victoria",,,,,1931,101–104,,,29,,,,English,,,,2B_p3_10,,
879,RPJINR3N,journalArticle,1932,"McIndoe, G. H.",Effects of the November frosts in Otago orchards,New Zealand Journal of Agriculture,,,,,1932,217,,3,44,,,,English,,,,2B_p3_9,,
880,C2Y95I5L,journalArticle,1930,"Bouget, J.; Davy de Virville, A.",Effects of inversion of temperature on annual cycle of development of vegetation in the Pyrenees,Revue générale de botanique,,,,,1930,337–347,,486,41,,,,French,,,,2B_p6_2,,
881,PD86NH32,journalArticle,1932,"Gassies, J. P.","Experiment in frost protection in an orchard in the department of Indre-et-Loire, France",La Météorologie (Paris),,,,,1932,483–487,,92–93,8,,,,French,,,,2B_p6_1,,
882,PWGDKY9X,journalArticle,1929,"Faes, H.; Staehelin, M.",The severe cold of the winter 1928–1929 and the vineyards of the Italian Switzerland,Terre Vaudoise,,,,,1929,,,,,,,,French,,,,2B_p5_12,,
883,D2TVK9H9,journalArticle,1932,"Dufrénoy, J.",Corrélation entre la température de l'air et la vitesse de croissance de la vigne [The correlation between the temperature of the air and the rate of growth of the vine],Comptes rendus hebdomadaires des séances de l'Académie des sciences,,,,,1932,639–640,,,194,,,,French,,,,,,
884,ALANBLCN,journalArticle,1933,"Crepin, C.",The effects of the frost of the 23rd April (1933) on cereals,Journal d'Agriculture pratique,,,,,1933,478–479,,24,97,,,,French,,,,,,
885,4WU4M8TW,journalArticle,1933,"Crépin, C.",Les effets de la gelée du 23 avril sur les céréales [The effects of the frost of the 23rd April on cereals],Comptes rendus hebdomadaires des séances de l'Académie d'Agriculture de France,,,https://gallica.bnf.fr/ark:/12148/bpt6k6204502g/f698.item.r=688,,1933,688–693,,,19,,,,French,,,,2B_p5_9,,
886,9AZ6HTLK,journalArticle,1927,"Gain, E.",Effect of high temperature on seed and the morphology of plants produced from embryos exposed to 115°C – 155°C,Revue générale de botanique,,,,,1927,306–329,,461,39,,,,French,,,,2B_p5_10,,
887,PWCNDLVP,journalArticle,1931,"Papadakis, J.",Study of the effect of temperature conditions during early growth upon relative earliness and earing of spring wheats. Cold as a positive factor of wheat yield,Bulletin de l'Association Internationale des Sélectionneurs de Plantes,,,,,1931,98–105,,1,4,,,,French,,,,2B_p5_8,,
888,4NZXRFWQ,journalArticle,1931,"Lauritzen, J. I.",Some effects of chilling temperatures on sweet potatoes,Journal of Agricultural Research,,,,,1931,617–627,,10,42,,,,English,,,,2B_p5_7,US Department of Agriculture,
889,3LKHNURU,journalArticle,1930,"Young, F. D.",Development of orchard heating,Bulletin of the American Meteorological Society,,10.1175/1520-0477-11.12.196,https://journals.ametsoc.org/doi/pdf/10.1175/1520-0477-11.12.196,,1930,196–199,,12,11,,,,English,,,,2B_p5_6,,
890,KD5QV8Y2,journalArticle,1930,"Carolus, R. L.",Effect of seasonal temperatures on chemical composition of kale (Brassica oleracea var. acephala),Proceedings of the American Society for Horticultural Science,,,,,1930,502–508,,,27,,,,English,,,,2B_p5_4,,
891,FBQI6I6D,journalArticle,1932,"Timmons, F. L.; Salmon, S. C.",The resistance of certain varieties and regional strains of alfalfa to controlled low temperatures,Journal of the American Society of Agronomy,,,https://dl.sciencesocieties.org/publications/aj/abstracts/24/8/AJ0240080642/preview/pdf,,1932,642–655,,8,24,,,,English,,,,2B_p5_3,,
892,VGQDNUW8,report,1931,"Johnson, J.; Ogden, W. B.",The relation of air conditions (humidity and temperature) to tobacco curing,,,,,,1931,48pp,,,,,,,English,Bulletin of the Wisconsin Agricultural Experiment Station,,,2B_p5_1,,110
893,PLPRJ6F9,journalArticle,1931,"Filinger, G. A.","The effect of temperature on feeding and development of the greenhouse leaftyer, Phlyctaenia ferrugalis HB",Journal of Economic Entomology,,10.1093/jee/24.1.52,https://academic.oup.com/jee/article-abstract/24/1/52/879502,,1931,52–54,,1,24,,,,English,,,,2B_p4_12,,
894,XHD93LQT,journalArticle,1931,"Martin, J. H.; Harris, J. A.; Jones, I. D.",Freezing-point depression and specific conductivity of sorghum tissue fluids,Journal of Agricultural Research,,,,,1931,57–69,,2,42,,,,English,,,,2B_p4_11,"US Department of Agriculture; Department of Botany, University of Minnesota",
895,PG9Y4TQA,journalArticle,1931,"Steinbauer, C. E.; Steinbauer, G. P.",Effects of temperature and dessication during storage on germination of seeds of the American elm (Ulmus americana L.),Proceedings of the American Society for Horticultural Science,,,,,1931,441–443,,,28,,,,English,,,,2B_p4_10,,
896,TRUGNE4L,journalArticle,1932,"Lund, E. J.",Comparison of the effects of temperature on the radial and longitudinal electric polarities in wood and cortex of the Douglas fir,Plant Physiology,,,https://www.jstor.org/stable/40020957,,1932,505–516,,3,7,,,,English,,,,2B_p4_9,,
897,Y2AWDLQ8,journalArticle,1931,"Newton, R.; Brown, W. R.",Frost precipitation of proteins of plant juice,Canadian Journal of Research,,10.1139/cjr31-056,https://www.nrcresearchpress.com/doi/pdf/10.1139/cjr31-056,,1931,87–110,,1,5,,,,English,,,,2B_p4_8,,
898,UI9ZSQWH,journalArticle,1931,"Newton, R.; Brown, W. R.; Anderson, J. A.",Chemical changes in nitrogen fractions of plant juice on exposure to frost,Canadian Journal of Research,,10.1139/cjr31-072,https://www.nrcresearchpress.com/doi/pdf/10.1139/cjr31-072,,1931,327–332,,3,5,,,,English,,,,2B_p4_7,,
899,2NAV7ZTR,journalArticle,1929,"Patwardhan, V. G.; Apte, N. G.",The chemical study of the effect of frost on cane crop and gur-making from frost-affected canes in the district of Ahmednugar in 1929,Agriculture and Livestock in India,,,,,1929,177–188,,2,1,,,,English,,,,2B_p4_6,,
900,KNHDSNM8,journalArticle,1932,"Ezekiel, W. N.; Taubenhaus, J. J.",Leaf temperatures of cotton plants with Phymatotrichum root rot,Science,,0.1126/science.75.1945.391,http://science.sciencemag.org/content/75/1945/391,,1932,391–392,,1945,75,,,,English,,,,2B_p4_4,,
901,T2BWT4NC,journalArticle,1932,"Ludwig, C. A.",The germination of cottonseed at low temperatures,Journal of Agricultural Research,,,https://naldc.nal.usda.gov/download/IND43968109/PDF,,1932,367–380,,4,44,,,,English,,,,2B_p4_3,South Carolina Agricultural Experiment Station,
902,ADFPNMVA,journalArticle,1929,"Kikkawa, S.",The influence of temperature of irrigation water on the growth and yield of rice,Proceedings of the Imperial Academy (Tokyo),,10.2183/pjab1912.5.303,https://www.jstage.jst.go.jp/article/pjab1912/5/7/5_7_303/_article/-char/en,,1929,303–305,,7,5,,,,English,,,,2B_p4_1,,
903,UM5W5FQK,journalArticle,1933,"Blake, M. A.",Effects of temperature on peaches,Bulletin of the New Jersey Agricultural Experiment Station,,,,,1933,5,,4,15,,,,English,,,,2B_p3_13,,
904,28VIBK5R,journalArticle,1927,"Schade, A.",Temperature relations of certain bryophytes and lichens,ISIS (Dresden),,,,,1927,38–55,,,,,,,German,,,,2B_p6_11,,
905,UR4XGHDX,journalArticle,1931,"Gassner, G.; Rabien, H.",Frost resistance tests on cereal stems,Der Züchter,,,,,1931,297–300,,1,3,,,,German,,,,2B_p6_10,,
906,74JXCWZU,journalArticle,1932,"Fucks, W. H.",On the testing of the cold resistance of winter cereals,Fortschritte der Landwirtschaft,,,,,1932,106–110,,4,7,,,,German,,,,2B_p6_9,,
907,52MRLUKL,journalArticle,1930,"Dörfel, F.",On the influence of frost and intermittent temperatures on the germination of various seeds,Botanisches Archiv,,,,,1930,1–50,,1/2,30,,,,German,,,,2B_p6_8,,
908,SFCFLXWX,journalArticle,1931,"Günther, E.",Research into the influence of frost on different soil types and the resulting influence on the growth of oats and barley,Landwirtschaftliche Jahrbücher,,,,,1931,893–921,,6,73,,,,German,,,,2B_p6_7,,
909,GJ74UTIU,journalArticle,1929,"Gassner, C.",The experimental determination of the frost resistance of corn plants,Der Züchter,,,,,1929,257–264,,9,1,,,,German,,,,2B_p6_6,,
